{
  "id": "art_biquinioutop",
  "slug": "biquini-ou-top",
  "titulo": "Biquíni ou top esportivo? Entenda as diferenças",
  "categoria": "treino-performance",
  "resumo": "Quando usar cada um e como escolher o ideal para o seu treino.",
  "corpo": "Visualmente, um top da linha Turk Fit e um top de biquíni da linha Praia podem até parecer parecidos — mas foram desenhados para exigências completamente diferentes, e entender essa diferença ajuda a escolher a peça certa para cada momento.\n\nUm biquíni é feito para estar molhado, exposto ao sol e ao sal, com um corte pensado para bronzeamento e conforto parado ou em movimento leve na água. Já o top esportivo da linha Turk Fit é construído com uma malha de compressão mais firme, alças e faixa da base reforçadas, pensadas para sustentar o busto durante movimento repetitivo de alto impacto — pular, correr, levantar peso.\n\nUsar um biquíni comum para treinar pode até funcionar por um treino ou outro, mas não entrega o mesmo suporte — e tende a perder a forma mais rápido, já que não foi pensado para esse tipo de exigência mecânica repetida.\n\n> Sustentação certa não é sobre aperto — é sobre o tecido e o corte terem sido pensados para o tipo de movimento que você vai fazer.\n\nNa dúvida entre as duas linhas, pensar primeiro no uso principal da peça — praia ou treino — já resolve a maior parte da escolha.",
  "capa": {
    "arquivo": "biquini-ou-top.webp",
    "alt": "Biquíni ou top esportivo? Entenda as diferenças"
  },
  "tempoLeitura": "4 min de leitura",
  "status": "publicado",
  "dataCriacao": "2026-08-18"
}
