{
  "id": "art_seo_compraonline",
  "slug": "como-escolher-moda-praia-online",
  "titulo": "Como comprar moda praia online com mais segurança",
  "categoria": "guia-de-cuidados",
  "resumo": "Confira medidas, descrições, fotos e políticas da loja para avaliar biquínis e maiôs antes de comprar pela internet.",
  "capa": {
    "arquivo": "moda-praia-ano-inteiro.webp",
    "alt": "Referência de moda praia para orientar uma compra online consciente"
  },
  "corpo": "Comprar moda praia online com mais segurança começa por ler a ficha do produto com atenção. Confira o que está incluído, os tamanhos disponíveis, as fotos, a composição quando informada e as políticas da loja. Se uma informação importante estiver ausente, pergunte antes de concluir o pedido em vez de presumir uma característica.\n\nA compra pela internet não permite experimentar a peça antes de recebê-la, por isso a descrição e as medidas têm papel importante na decisão.\n\n## Leia o título e a descrição completa\n\nConfirme se o produto é um conjunto, um top avulso, uma calcinha ou um maiô. Algumas lojas vendem partes de biquíni separadamente, e as fotos podem mostrar combinações que não estão incluídas no anúncio. Confira também o modelo, a cor e os detalhes descritos.\n\nNão deduza a composição, a presença de bojo, o tipo de forro ou a proteção UV apenas pela aparência. Se esses dados forem decisivos para você e não estiverem publicados, entre em contato com o atendimento.\n\n## Confira tamanhos e medidas\n\nUse a tabela de medidas da loja quando estiver disponível e compare com suas próprias medidas. Não presuma que a grade seja igual entre marcas ou entre todos os modelos de uma mesma marca. O corte, a elasticidade e as regulagens podem mudar o caimento.\n\nSe não encontrar uma tabela, pergunte quais medidas podem ajudar a escolher. Evite inventar uma medida ou escolher automaticamente o tamanho de outra roupa como garantia de que servirá.\n\n## Observe as fotos\n\nVeja se as imagens mostram a peça de frente, de costas e em detalhes. Fotos ajudam a compreender a cor, a modelagem e o acabamento visível, mas não substituem informações técnicas. A cor exibida também pode variar conforme a tela e a iluminação.\n\nQuando a ficha apresenta mais de uma imagem, compare os ângulos para entender alças, amarrações, fechos e recortes. Se uma característica não estiver visível nem descrita, não assuma que exista.\n\n## Leia as políticas antes de pagar\n\nConfira as informações de envio, prazo de entrega, atendimento, troca e reembolso. Veja como entrar em contato com a loja caso tenha dúvida sobre o tamanho ou precise resolver uma questão após a compra. Salve a confirmação do pedido e as informações recebidas.\n\nNa Turkista, consulte as páginas de política de envio e de troca e reembolso para entender as condições publicadas. Se sua situação não estiver esclarecida, entre em contato antes de finalizar.\n\n## Avalie a loja e os canais de atendimento\n\nProcure informações claras sobre a marca, meios de contato e condições comerciais. Um atendimento que esclarece dúvidas sobre o produto ajuda você a decidir com base em informações reais. Evite comprar com base apenas em uma fotografia ou em uma promessa que não esteja detalhada.\n\nGuarde o nome do produto e a descrição que consultou. Isso facilita o atendimento se precisar confirmar o que comprou.\n\n## Compare sem se prender apenas ao preço\n\nCompare características equivalentes: o que está incluído, tamanhos, composição publicada, acabamento visível e políticas. O preço isolado não informa todos esses fatores. Escolha uma peça que faça sentido para sua preferência e para o uso pretendido.\n\n## Perguntas frequentes\n\n### Como saber se o biquíni é vendido como conjunto?\nLeia o título e a descrição. Confirme se o anúncio inclui top e calcinha ou apenas uma das partes.\n\n### Como escolher tamanho sem experimentar?\nUse a tabela de medidas quando disponível e pergunte à loja se faltar informação. Não presuma que o tamanho de outra marca será igual.\n\n### Posso confiar apenas nas fotos?\nNão. As fotos ajudam a avaliar o visual, mas devem ser acompanhadas da descrição, dos tamanhos e das políticas.\n\n### O que conferir sobre entrega e troca?\nLeia as políticas específicas da loja e verifique como tirar dúvidas ou solicitar atendimento.\n\n### O que fazer se a composição não estiver informada?\nPergunte ao atendimento antes de comprar, principalmente se a composição for essencial para sua decisão.\n\nUma compra online mais consciente depende de informação clara. Confira o que está incluído, compare medidas e leia as políticas antes de concluir o pedido.",
  "tempoLeitura": "5 min de leitura",
  "status": "publicado",
  "dataCriacao": "2026-10-25"
}
