{
  "id": "art_seo_erroslavar",
  "slug": "erros-ao-lavar-roupa-de-praia",
  "titulo": "Erros comuns ao lavar biquínis e maiôs",
  "categoria": "guia-de-cuidados",
  "resumo": "Conheça práticas de lavagem e secagem que podem prejudicar roupas de banho e saiba como seguir os cuidados recomendados para cada peça.",
  "capa": {
    "arquivo": "lavagem-secagem.webp",
    "alt": "Referência visual para os cuidados de lavagem de roupas de banho"
  },
  "corpo": "Alguns hábitos de lavagem podem desgastar biquínis e maiôs antes do necessário: torcer com força, usar água muito quente sem verificar a etiqueta, aplicar produtos agressivos ou guardar a peça ainda úmida. O cuidado mais seguro é seguir as instruções do fabricante e manusear o tecido delicadamente.\n\nComo as roupas de banho variam em composição, forro e acabamento, não existe uma única regra que sirva para todos os modelos. Use estas orientações como uma lista de atenção e confira sempre a etiqueta da peça.\n\n## Erro 1: deixar a peça molhada por muito tempo\n\nDepois de sair do mar ou da piscina, evite manter o biquíni ou maiô molhado dentro de uma bolsa fechada por horas. Enxágue em água doce assim que possível e deixe a peça secar em local ventilado, seguindo as recomendações de lavagem.\n\nO acúmulo de umidade pode causar odor e torna o armazenamento inadequado. Se estiver viajando, use uma bolsa separada para a roupa molhada e retire a peça assim que puder.\n\n## Erro 2: torcer para retirar a água\n\nTorcer com força pode puxar costuras, alças e partes elásticas. Em vez disso, pressione suavemente a peça para retirar o excesso de água. Se necessário, coloque-a sobre uma toalha limpa e pressione sem esfregar.\n\nEsse cuidado é especialmente importante quando há detalhes decorativos, amarrações ou estruturas que podem ser deformadas pelo esforço.\n\n## Erro 3: usar produtos sem conferir a etiqueta\n\nAlvejantes, solventes e produtos de limpeza inadequados podem alterar a cor ou afetar materiais delicados. Não aplique uma mistura caseira para remover manchas sem verificar se é segura para a composição. Também não presuma que amaciante seja recomendado para qualquer tecido.\n\nEscolha o produto de lavagem conforme as instruções do fabricante. Se a etiqueta não estiver disponível e houver uma mancha difícil, consulte a loja ou o fabricante antes de tentar uma solução agressiva.\n\n## Erro 4: usar calor excessivo\n\nÁgua quente, secadora e ferro podem não ser adequados para certas peças elásticas. Verifique a temperatura recomendada e as instruções de secagem. Quando indicado, prefira secar à sombra em local ventilado.\n\nNão deixe a roupa de banho sob sol direto por períodos prolongados se as instruções recomendarem outra forma de secagem. O objetivo é evitar exposições desnecessárias que possam afetar a aparência e o material.\n\n## Erro 5: esfregar o tecido ou as costuras\n\nEsfregar com escova ou friccionar a peça contra uma superfície áspera pode puxar fios, danificar acabamentos e desgastar áreas delicadas. Lave com movimentos suaves e dê atenção especial a argolas, fechos e partes decorativas.\n\nSe houver areia, remova-a com cuidado antes de esfregar ou dobrar a peça. Evite puxar fios soltos; procure orientação para lidar com danos visíveis.\n\n## Erro 6: guardar antes de secar completamente\n\nMesmo após a lavagem, uma peça pode reter água em dobras, forros ou costuras. Espere secar por inteiro antes de colocar em gaveta, mala ou organizador fechado. Guarde em local limpo e ventilado, sem comprimir bojos e detalhes.\n\n## Uma rotina simples de cuidado\n\n1. Enxágue a peça em água doce após o uso.\n2. Confira a etiqueta antes de lavar.\n3. Use o método e o produto indicados.\n4. Retire o excesso de água sem torcer.\n5. Seque conforme a orientação do fabricante.\n6. Guarde apenas quando estiver totalmente seca.\n\n## Perguntas frequentes\n\n### Posso lavar biquíni na máquina?\nDepende da etiqueta. Não use máquina se o fabricante recomendar lavagem manual.\n\n### Pode usar sabão em pó?\nConfira as instruções do produto e escolha um método compatível com a peça. Evite produtos agressivos ou não recomendados.\n\n### Posso secar roupa de banho ao sol?\nSiga a etiqueta. Se recomendar secagem à sombra, evite exposição direta prolongada.\n\n### Como tirar cheiro de roupa de banho?\nEnxágue, lave conforme a etiqueta e seque completamente em local ventilado. Não misture produtos de limpeza por conta própria.\n\n### O que fazer se o tecido ou a costura parecer danificado?\nEvite puxar ou cortar fios sem avaliar o dano. Procure a loja ou um profissional de reparo para orientação.\n\nOs erros mais comuns são evitáveis quando você consulta a etiqueta, reduz o atrito e não deixa a peça úmida por muito tempo. Cada roupa de banho tem suas particularidades, por isso a instrução do fabricante deve orientar a rotina.",
  "tempoLeitura": "5 min de leitura",
  "status": "publicado",
  "dataCriacao": "2026-10-25"
}
