{
  "id": "art_seo_escolherbiquini",
  "slug": "como-escolher-biquini-feminino",
  "titulo": "Como escolher biquíni feminino: modelos, caimento e estilo",
  "categoria": "estilo",
  "resumo": "Compare modelos, ajuste, conforto e combinações para escolher um biquíni que faça sentido para seu estilo e para o uso que você pretende dar à peça.",
  "capa": {
    "arquivo": "cores-tom-de-pele.webp",
    "alt": "Referência de cores e estilo para escolher um biquíni feminino"
  },
  "corpo": "Escolher um biquíni feminino fica mais simples quando você considera três pontos: o modelo de que gosta, o ajuste no corpo e a ocasião em que pretende usar a peça. Não existe um formato universalmente melhor. O biquíni certo é aquele que combina com suas preferências e permite que você aproveite a praia ou a piscina com conforto.\n\nAntes de decidir pela cor ou pela tendência do momento, pense em como você gosta de se movimentar, quanto ajuste deseja nas alças e na cintura e se prefere comprar um conjunto ou combinar partes de cima e de baixo separadamente.\n\n## Conheça os modelos mais comuns\n\nO cortininha costuma ter triângulos ajustáveis e amarrações, permitindo alterar a posição da parte superior. É uma opção para quem gosta de regulagem, mas vale conferir como os nós ficam posicionados e se permanecem confortáveis durante o uso.\n\nO modelo meia-taça ou com bojo tem uma estrutura diferente, que pode incluir copas moldadas e detalhes de sustentação. Como a construção muda de uma peça para outra, leia a descrição e confira se o bojo é removível, fixo ou não faz parte do produto.\n\nJá os tops retos, faixa e modelos com alças mais largas oferecem propostas visuais distintas. A escolha depende do nível de cobertura, da liberdade de movimento e da sensação de segurança que você prefere. Na parte de baixo, há opções de laterais finas, amarrações, cintura mais alta e recortes variados.\n\n## Como avaliar o caimento\n\nUma peça bem ajustada deve ficar no lugar sem causar dor, apertar excessivamente ou exigir que você a reposicione o tempo todo. Observe se as alças deixam marcas desconfortáveis, se a faixa das costas se mantém estável e se as amarrações permitem regular o ajuste sem ficarem no limite.\n\nNa calcinha, confira se as laterais permanecem confortáveis ao sentar, caminhar e se movimentar. Se a peça enrola, escorrega ou repuxa de forma persistente, pode ser sinal de que outro tamanho ou modelagem funcionará melhor.\n\nNão use apenas o tamanho que costuma comprar como critério definitivo. A modelagem, a elasticidade e a construção variam entre peças. Sempre que houver tabela de medidas, compare as medidas indicadas com as suas e confira a descrição específica do produto.\n\n## Escolha de acordo com a ocasião\n\nPara relaxar na praia, você pode priorizar o toque do tecido, as amarrações que considera confortáveis e o estilo que deseja usar. Para nadar ou brincar na água, preste atenção à estabilidade das alças e ao ajuste geral, sem presumir que todo modelo foi desenvolvido para qualquer intensidade de movimento.\n\nEm viagens, peças que combinam com mais de uma parte de baixo ajudam a criar diferentes looks com menos itens na mala. Um top liso pode conversar com uma calcinha estampada, por exemplo, desde que as cores e os acabamentos harmonizem com o resultado que você procura.\n\n## Cores, estampas e combinações\n\nUma paleta coordenada é um ponto de partida prático. Você pode combinar tons próximos, escolher uma cor neutra para equilibrar uma estampa marcante ou apostar no contraste entre duas cores que goste de usar. Não é necessário seguir regras fixas baseadas no tom de pele: a preferência pessoal deve orientar a decisão.\n\nSe quiser versatilidade, pense nas peças que já possui. Um top avulso pode render mais combinações quando conversa com duas ou três calcinhas diferentes. Antes de comprar, confirme se o produto é vendido como conjunto ou apenas como parte superior ou inferior.\n\n## O que conferir antes de comprar\n\nLeia a descrição completa e observe as fotos em diferentes ângulos, quando disponíveis. Verifique o tamanho disponível, o tipo de amarração, a presença de bojo, o forro informado pelo fabricante e as instruções de cuidado. Não presuma que dois modelos com aparência semelhante tenham a mesma composição ou o mesmo ajuste.\n\nNa Turkista, o catálogo inclui opções de biquínis e partes superiores vendidas separadamente. Confira a ficha de cada peça para confirmar exatamente o que está incluído no produto e quais tamanhos estão disponíveis.\n\n## Perguntas frequentes\n\n### Qual modelo de biquíni é melhor?\nNão há um modelo ideal para todas as pessoas. Compare a cobertura, as regulagens, a construção e o conforto que você procura.\n\n### Como saber se o biquíni está apertado?\nObserve se causa dor, restringe o movimento ou deixa marcas desconfortáveis. O ajuste deve ser firme o suficiente para manter a peça no lugar sem incomodar.\n\n### Posso combinar top e calcinha de modelos diferentes?\nSim. Coordenar cores, estampas e acabamentos é uma forma prática de criar um conjunto personalizado. Confirme apenas se as peças são vendidas separadamente.\n\n### Como escolher o tamanho pela internet?\nUse a tabela de medidas da loja quando disponível e compare com suas medidas. Confira também a descrição e a modelagem específica da peça.\n\n### Um biquíni serve para nadar e praticar esportes?\nDepende da construção e da atividade. Avalie estabilidade, amarrações e indicações do fabricante; não presuma que todo modelo é adequado para movimentos intensos.\n\nA melhor escolha começa por entender o que você espera da peça. Compare modelos, confirme os detalhes do produto e priorize um caimento confortável, sem se prender a regras rígidas de estilo.",
  "tempoLeitura": "5 min de leitura",
  "status": "publicado",
  "dataCriacao": "2026-10-25"
}
