{
  "id": "art_pecasmovimento",
  "slug": "pecas-movimento",
  "titulo": "Peças que te acompanham em cada movimento",
  "categoria": "treino-performance",
  "resumo": "Sustentação onde o corpo precisa, liberdade onde o treino pede.",
  "corpo": "A linha Turk Fit nasceu de uma pergunta simples: por que uma peça de treino teria que escolher entre sustentação e liberdade de movimento? Para a gente, as duas coisas precisam existir juntas — e é isso que orienta cada corte da linha.\n\nSustentação vem de faixas e costuras reforçadas exatamente nos pontos que mais recebem impacto durante o treino, sem comprimir onde não precisa. Liberdade de movimento vem da elasticidade em quatro direções do tecido, que acompanha agachamento, alongamento e giro sem restringir a amplitude.\n\nTestar cada peça em movimento real — não só parada no provador — é parte do processo antes de qualquer corte novo entrar em produção. É esse teste que separa uma peça bonita de uma peça que realmente aguenta um treino pesado, semana após semana.\n\n> Uma peça de treino boa não se nota quando está parada — se nota no meio do movimento, quando você esquece que está com ela.\n\nSe você treina com intensidade e já passou por peças que perderam a forma rápido demais, vale conhecer a linha Turk Fit.",
  "capa": {
    "arquivo": "pecas-movimento.webp",
    "alt": "Peças que te acompanham em cada movimento"
  },
  "tempoLeitura": "4 min de leitura",
  "status": "publicado",
  "dataCriacao": "2026-08-18"
}
