{
  "id": "art_modapraiaanointeiro",
  "slug": "moda-praia-ano-inteiro",
  "titulo": "Moda praia o ano inteiro: como usar além do verão",
  "categoria": "estilo",
  "resumo": "Peças versáteis que acompanham você em qualquer estação do ano.",
  "corpo": "É fácil pensar em moda praia como algo que só sai do armário em dezembro. Mas quem já usou uma peça de lycra de qualidade sabe: o caimento e o conforto que fazem sentido na areia também funcionam muito bem fora dela — e o ano inteiro.\n\nUm maiô Turkista, por exemplo, pode virar um body por baixo de uma calça de cintura alta, criando uma base lisa sem marcas visíveis. Biquínis de recorte mais coberto funcionam como top em dias quentes fora de temporada, combinados com uma saia ou short. E as peças da linha Turk Fit não têm estação: são treino o ano todo, dentro ou fora da academia.\n\nEssa versatilidade não é acidente — é consequência direta de peças bem cortadas, em tecido de qualidade, feitas para durar além de uma única temporada de verão.\n\n> Peça exclusiva e bem-feita não tem prazo de validade de estação — ela acompanha o seu movimento o ano todo.\n\nSe você está pensando em novas formas de usar uma peça que já tem, ou quer indicação de qual peça combina com o seu estilo, é só chamar no WhatsApp — a gente ajuda a pensar junto.",
  "capa": {
    "arquivo": "moda-praia-ano-inteiro.webp",
    "alt": "Moda praia o ano inteiro: como usar além do verão"
  },
  "tempoLeitura": "4 min de leitura",
  "status": "publicado",
  "dataCriacao": "2026-08-18"
}
