{
  "id": "art_seo_cuidarfitness",
  "slug": "como-cuidar-de-roupas-fitness",
  "titulo": "Como lavar e conservar roupas fitness",
  "categoria": "guia-de-cuidados",
  "resumo": "Confira cuidados de lavagem, secagem e armazenamento para manter roupas fitness em boas condições, seguindo a etiqueta de cada peça.",
  "capa": {
    "arquivo": "lavagem-secagem.webp",
    "alt": "Referência de lavagem e conservação de roupas fitness"
  },
  "corpo": "Para lavar e conservar roupas fitness, siga primeiro as instruções da etiqueta e evite deixar peças suadas ou úmidas fechadas dentro da bolsa por muito tempo. A lavagem, a secagem e o armazenamento corretos ajudam a reduzir odores e desgastes evitáveis, mas não garantem uma duração específica para todas as roupas.\n\nComo tops, leggings e shorts podem ter composições e acabamentos diferentes, não aplique automaticamente o mesmo método a todas as peças.\n\n## Não deixe a roupa úmida na bolsa\n\nDepois do treino, retire as peças da bolsa assim que possível. Se não puder lavar imediatamente, mantenha-as separadas de itens limpos e evite deixá-las comprimidas em um espaço fechado por muitas horas.\n\nA umidade retida pode contribuir para odores persistentes. Organize a bolsa com um compartimento separado para roupas usadas e lave as peças assim que a rotina permitir, seguindo a etiqueta.\n\n## Confira a etiqueta antes de lavar\n\nVerifique a temperatura recomendada, o método de lavagem e os produtos permitidos. Se a etiqueta indicar lavagem manual, não use máquina por conveniência. Evite alvejantes, solventes ou misturas caseiras que não tenham sido recomendados para a peça.\n\nQuando houver manchas, não esfregue agressivamente nem aplique um produto forte sem conferir a compatibilidade. Se a instrução não estiver disponível, peça orientação ao fabricante ou à loja.\n\n## Reduza o atrito\n\nLave as peças com delicadeza e evite escovas ou fricção intensa sobre costuras, estampas e superfícies delicadas. Fechos e acessórios podem prender fios, então separe itens que possam danificar outros tecidos.\n\nNão torça a roupa com força para retirar água. Pressione suavemente e siga a recomendação de secagem indicada na etiqueta.\n\n## Seque de forma adequada\n\nVerifique se a etiqueta permite secadora ou se recomenda secagem ao ar. Não use calor excessivo por hábito: ele pode ser inadequado para certos materiais elásticos e acabamentos. Se a secagem à sombra for recomendada, escolha um local ventilado e deixe a peça estendida de forma que não fique deformada.\n\nEspere secar completamente antes de guardar, inclusive em cós, forros, costuras e áreas dobradas.\n\n## Guarde sem comprimir\n\nArmazene as peças em local limpo, seco e arejado. Evite comprimir excessivamente tops, bojos ou detalhes. Organize por tipo ou frequência de uso para encontrar os itens sem puxar alças ou costuras.\n\nSe uma roupa tiver instruções especiais de conservação, mantenha-as como referência. A mesma regra vale para estampas, acabamentos e diferentes composições.\n\n## Monte uma rotina simples\n\nAo voltar do treino, separe as roupas usadas, confira a etiqueta quando necessário, lave de acordo com a recomendação e deixe secar por completo. Esse processo ajuda a evitar que peças úmidas sejam esquecidas e reduz a necessidade de soluções agressivas para remover odores.\n\n## Perguntas frequentes\n\n### Posso lavar roupa fitness na máquina?\nDepende da etiqueta. Siga o método indicado para cada peça.\n\n### Como tirar cheiro de suor?\nLave conforme as instruções e não deixe a roupa úmida em uma bolsa fechada por muito tempo. Evite misturar produtos de limpeza.\n\n### Posso usar amaciante?\nConfira a orientação do fabricante; não presuma que seja adequado para todos os tecidos.\n\n### Posso secar roupa fitness na secadora?\nSomente se a etiqueta permitir. Evite calor não recomendado.\n\n### Como guardar leggings e tops?\nEspere secar completamente e guarde em local limpo e seco, sem comprimir detalhes que possam deformar.\n\nA conservação começa com a etiqueta e com hábitos simples: retirar a peça da bolsa, lavar com cuidado e secar por inteiro. Adapte a rotina às instruções de cada produto.",
  "tempoLeitura": "5 min de leitura",
  "status": "publicado",
  "dataCriacao": "2026-10-25"
}
