{
  "id": "art_seo_duplaface",
  "slug": "biquini-dupla-face-como-funciona",
  "titulo": "Biquíni dupla face: como funciona e por que vale conhecer esse modelo",
  "categoria": "estilo",
  "resumo": "Entenda o que caracteriza um biquíni dupla face, como variar o visual e quais cuidados ajudam a preservar a peça.",
  "capa": {
    "arquivo": "tecido-certo.webp",
    "alt": "Detalhe de tecido de moda praia para ilustrar o biquíni dupla face"
  },
  "corpo": "Um biquíni dupla face é confeccionado para permitir o uso dos dois lados da peça, desde que o modelo específico tenha essa característica descrita pelo fabricante. Em geral, cada lado apresenta uma cor, estampa ou acabamento diferente, oferecendo mais de uma possibilidade de composição sem precisar levar outra peça.\n\nO principal é confirmar se o produto é realmente dupla face e como deve ser usado. Uma peça com forro comum não é automaticamente reversível: a construção, as costuras e o acabamento precisam permitir que os dois lados sejam usados adequadamente.\n\n## Como funciona a dupla face\n\nEm um modelo dupla face, o tecido e o acabamento são pensados para que ambos os lados possam ficar aparentes. Algumas peças apresentam duas cores; outras combinam estampas ou texturas. O resultado depende do produto, por isso as fotografias e a descrição são essenciais para saber quais visuais a peça oferece.\n\nObserve também alças, nós, argolas e outros detalhes. Mesmo quando o tecido é reversível, determinados enfeites ou acabamentos podem ter um lado preferencial. A ficha do produto deve ajudar a esclarecer como a peça foi projetada para ser vestida.\n\n## Como aproveitar as duas possibilidades\n\nSe cada lado tem uma cor diferente, trate-os como partes distintas do guarda-roupa. Um lado pode combinar com uma calcinha lisa em tom neutro, enquanto o outro funciona com uma peça de cor contrastante. Se os lados tiverem estampas, procure uma calcinha que repita uma cor de cada visual.\n\nPara viagens, pense em combinações antes de arrumar a mala. Um top dupla face pode criar variações com diferentes partes de baixo, desde que os tamanhos e as modelagens sejam compatíveis com suas preferências. Isso não significa que uma única peça substitua todas as outras, mas pode ampliar as opções de composição.\n\n## O que conferir antes da compra\n\nLeia o nome e a descrição do produto para verificar a indicação dupla face. Observe fotos dos dois lados e confirme se a peça é vendida como parte superior avulsa ou como conjunto. Esse detalhe é importante porque muitos tops de biquíni são vendidos separadamente.\n\nConfira também o tamanho disponível, o tipo de amarração e as instruções de conservação. Não presuma que as duas faces tenham exatamente o mesmo toque ou que todos os modelos aceitem a mesma forma de lavagem; siga sempre as orientações fornecidas para aquela peça.\n\n## Cuidados para preservar a peça\n\nDepois do uso no mar ou na piscina, enxágue a roupa de banho em água doce assim que possível. Lave conforme a etiqueta, sem esfregar agressivamente o tecido nem torcer a peça para retirar a água. O atrito excessivo pode prejudicar o acabamento, principalmente em materiais delicados ou metalizados.\n\nDeixe secar completamente à sombra, em local ventilado, antes de guardar. Evite deixar a peça molhada por muito tempo dentro de uma bolsa ou dobrada em uma gaveta. Se houver detalhes decorativos, manuseie-os com cuidado e não puxe as alças ou os nós com força.\n\n## O modelo dupla face combina com você?\n\nConsidere como costuma organizar suas roupas de praia. Se gosta de variar cores e montar combinações diferentes, o modelo pode ser uma opção interessante. Se prefere um visual específico e raramente alterna as peças, talvez outros critérios, como o caimento ou o tipo de alça, sejam mais importantes.\n\nNa Turkista há tops dupla face descritos individualmente no catálogo. Confira as fotos e os detalhes do produto para entender quais lados estão disponíveis e como a peça é vendida.\n\n## Perguntas frequentes\n\n### Todo biquíni com forro é dupla face?\nNão. O forro e a construção dupla face são características diferentes. Confirme a indicação na descrição do fabricante.\n\n### Posso usar os dois lados do top?\nSomente quando o modelo foi desenvolvido para isso. Consulte a descrição e observe as imagens dos dois lados.\n\n### O biquíni dupla face é sempre um conjunto?\nNão necessariamente. Há tops vendidos separadamente. Confira exatamente quais peças estão incluídas no anúncio.\n\n### Como lavar um biquíni dupla face?\nSiga a etiqueta e as instruções específicas do produto. Em geral, é prudente evitar calor excessivo, torção e atrito forte.\n\n### Como combinar cada lado?\nEscolha partes de baixo que repitam uma cor ou criem contraste com cada lado. Uma calcinha lisa costuma oferecer flexibilidade para composições diferentes.\n\nO valor da dupla face está na possibilidade de variar o visual com a mesma peça. Antes de comprar, confirme a construção, as opções de uso e os cuidados indicados para conservar o produto.",
  "tempoLeitura": "5 min de leitura",
  "status": "publicado",
  "dataCriacao": "2026-10-25"
}
