{
  "id": "art_seo_tecido",
  "slug": "como-identificar-bom-tecido-moda-praia",
  "titulo": "Como escolher um bom tecido para moda praia",
  "categoria": "tecido-tecnologia",
  "resumo": "Saiba o que observar na composição, elasticidade, toque e acabamento de uma peça de moda praia antes de comprar.",
  "capa": {
    "arquivo": "tecido-certo.webp",
    "alt": "Detalhe de tecido usado como referência para avaliar moda praia"
  },
  "corpo": "Escolher um bom tecido para moda praia envolve observar mais do que o toque. A composição, a elasticidade, o acabamento e as instruções de cuidado ajudam a entender como a peça foi construída e se ela combina com o uso que você pretende fazer. Não existe um tecido único que seja melhor para todas as situações: a escolha depende do modelo, da atividade e das informações fornecidas pelo fabricante.\n\nAntes de comprar, leia a ficha do produto e procure dados objetivos. Se a composição não estiver informada, não é possível deduzi-la com segurança apenas pela aparência ou por uma fotografia.\n\n## Confira a composição\n\nA composição indica quais fibras fazem parte do tecido e, quando disponível, a proporção de cada uma. Em roupas de banho, é comum encontrar materiais elásticos misturados a outras fibras, mas a composição varia entre produtos. Não presuma que dois itens da mesma categoria tenham a mesma mistura.\n\nObserve se a ficha informa a composição percentual e se há instruções específicas de conservação. Quando o dado não estiver disponível, entre em contato com a loja antes de tomar uma decisão baseada em uma característica técnica que não foi confirmada.\n\n## Avalie a elasticidade e a recuperação\n\nA elasticidade influencia como a peça acompanha os movimentos e se ajusta ao corpo. Se estiver avaliando uma peça presencialmente, manipule o tecido com delicadeza, sem puxar costuras ou forçar o material. Veja se ele retorna à forma original de maneira uniforme, sem criar ondulações persistentes.\n\nEsse teste simples não substitui informações técnicas e não permite garantir a durabilidade. O corte, a costura, o tipo de forro e os cuidados de lavagem também influenciam o comportamento da peça ao longo do uso.\n\n## Observe o toque e o acabamento\n\nO toque é uma questão de preferência pessoal, mas pode ajudar a identificar se o material parece confortável para você. Observe a superfície, a uniformidade do tecido e se existem fios puxados, falhas visíveis ou áreas que parecem excessivamente frágeis.\n\nConfira as costuras, as bordas e a forma como o tecido se encontra com alças e fechos. Em peças forradas, verifique se o forro está descrito e se as bordas ficam planas. Nem todo produto tem o mesmo tipo de acabamento, então avalie cada modelo individualmente.\n\n## Considere o uso pretendido\n\nUma peça para relaxar à beira da piscina pode ter requisitos diferentes de uma roupa destinada a surfe ou a movimentos mais intensos. Pense na atividade, na cobertura desejada e na estabilidade do modelo. Não conclua que uma peça é adequada para uma atividade específica apenas porque é feita de material elástico.\n\nPara roupas usadas no mar ou em piscinas, também vale considerar a facilidade de enxágue e os cuidados indicados na etiqueta. O contato com sal, cloro, protetor solar e superfícies ásperas pode exigir atenção durante o uso e a conservação.\n\n## Leia as instruções de lavagem\n\nUm bom material também precisa receber os cuidados recomendados pelo fabricante. Verifique a temperatura da água, o método de lavagem e a forma de secagem indicados na etiqueta. Evite aplicar conselhos genéricos quando a peça tiver instruções próprias.\n\nNão use o nome de uma fibra como garantia automática de que o produto não desbota, não deforma ou dura por um período específico. O resultado depende de diferentes fatores, inclusive frequência de uso, exposição e cuidados.\n\n## O que conferir na compra online\n\nLeia a descrição completa, observe fotos de diferentes ângulos e confira os tamanhos disponíveis. Se composição, proteção UV ou outra característica técnica não estiver indicada, não presuma que exista. Peça esclarecimentos antes de comprar se esse dado for decisivo para você.\n\nNo catálogo Turkista, as informações são apresentadas na ficha de cada produto. Compare os detalhes disponíveis e considere a peça como um conjunto de características — tecido, construção, modelagem e instruções de cuidado.\n\n## Perguntas frequentes\n\n### Como saber se um tecido tem elastano?\nConfira a composição publicada pelo fabricante ou pela loja. A aparência e o toque não confirmam a presença nem a porcentagem da fibra.\n\n### Tecido mais grosso é sempre melhor?\nNão. A espessura isolada não determina qualidade ou adequação. Considere composição, construção, acabamento e uso pretendido.\n\n### Como avaliar o tecido por fotos?\nAs fotos ajudam a observar cor, textura aparente e acabamento visível, mas não confirmam composição nem desempenho técnico.\n\n### Todo tecido de moda praia tem proteção UV?\nNão presuma essa característica. Verifique se a ficha informa proteção UV e se há documentação técnica quando necessário.\n\n### O que fazer se a composição não estiver informada?\nPergunte à loja antes de comprar, principalmente se a composição for um critério importante para sua decisão.\n\nA escolha mais segura combina informações verificáveis com a avaliação do caimento e do conforto. Leia a ficha, confira o acabamento e evite atribuir ao tecido características que não foram confirmadas.",
  "tempoLeitura": "5 min de leitura",
  "status": "publicado",
  "dataCriacao": "2026-10-25"
}
