{
  "id": "art_seo_guardar",
  "slug": "como-guardar-biquinis-e-maios",
  "titulo": "Como guardar biquínis e maiôs para conservar as peças",
  "categoria": "guia-de-cuidados",
  "resumo": "Aprenda a secar, dobrar e organizar roupas de banho sem guardar umidade nem pressionar desnecessariamente os detalhes.",
  "capa": {
    "arquivo": "cuidados-biquini.webp",
    "alt": "Peça de moda praia como referência para organizar e conservar roupas de banho"
  },
  "corpo": "Para guardar biquínis e maiôs corretamente, o primeiro passo é garantir que estejam completamente secos. Depois, escolha um local limpo, arejado e longe de umidade, e organize as peças sem comprimir bojos, alças, amarrações ou detalhes delicados. Uma rotina simples ajuda a evitar odores e deformações causadas pelo armazenamento inadequado.\n\nAntes de dobrar a peça, confira a etiqueta. Alguns acabamentos exigem atenção específica e as orientações do fabricante devem prevalecer sobre dicas genéricas.\n\n## Seque completamente antes de guardar\n\nDepois de lavar ou enxaguar, retire o excesso de água com delicadeza e deixe a peça secar em local ventilado. Não guarde roupas de banho úmidas dentro de gavetas, malas, caixas ou sacos fechados. Mesmo quando a superfície parece seca, verifique áreas dobradas, costuras e forros.\n\nSe estiver viajando, separe as peças molhadas das roupas secas até conseguir enxaguá-las e secá-las adequadamente. Evite deixar biquínis molhados em bolsas por longos períodos.\n\n## Escolha um lugar seco e arejado\n\nGuarde as peças em uma gaveta limpa, prateleira ou organizador que não retenha umidade. Evite locais próximos a áreas molhadas ou com pouca ventilação. Se o armário costuma ficar úmido, resolva essa condição antes de armazenar roupas delicadas.\n\nOrganizadores podem ajudar a separar tops, calcinhas e maiôs, mas não precisam ser apertados. O objetivo é manter as peças acessíveis e protegidas de atrito excessivo, não comprimi-las ao máximo.\n\n## Dobre sem pressionar os detalhes\n\nDobre os tecidos com cuidado, evitando criar sempre vincos muito fortes no mesmo ponto. Não puxe alças para apertar o pacote nem force nós e amarrações para caber em espaços pequenos. Em peças com detalhes decorativos, deixe o acabamento posicionado de modo que não fique pressionado contra objetos rígidos.\n\nSe o top tiver bojo, siga as orientações de armazenamento do modelo. Quando for possível remover a estrutura, guarde os componentes conforme as instruções do fabricante, sem dobrar ou amassar o bojo de maneira que altere sua forma.\n\n## Separe peças por tipo\n\nSeparar tops, calcinhas, maiôs e peças de surf pode facilitar a escolha e reduzir o tempo em que você manuseia toda a gaveta. Você pode organizar por cor, modelo ou frequência de uso. Escolha um sistema que ajude a encontrar as peças sem precisar puxar outras pela alça ou pelo tecido.\n\nSe houver peças com fechos, argolas ou superfícies que possam prender fios, guarde-as de forma que esses elementos não fiquem esfregando continuamente contra outros tecidos.\n\n## Cuidados antes de guardar por uma temporada\n\nSe vai guardar roupas de banho por meses, lave e seque cada peça antes de armazenar. Confira se não há resíduos de protetor solar, areia ou sal. Guarde em local seco e volte a verificar as condições do armário de tempos em tempos, principalmente em períodos úmidos.\n\nNão use sacos herméticos para guardar peças ainda úmidas. Se optar por caixas ou organizadores fechados, certifique-se de que as roupas estão totalmente secas e que o local não retém umidade.\n\n## Como organizar para viagens\n\nLeve uma bolsa separada para roupas molhadas e retire as peças assim que puder. No retorno, não deixe o conteúdo da mala fechado por vários dias. Enxágue, lave e seque as peças conforme a etiqueta antes de guardá-las de volta no armário.\n\nUma pequena organização antes da viagem — escolher as peças, verificar os cuidados e separar um espaço para as usadas — ajuda a evitar que roupas molhadas fiquem misturadas com itens limpos.\n\n## Perguntas frequentes\n\n### Posso guardar biquíni em saco plástico?\nSomente depois de estar completamente seco, e sem deixar o material comprimido ou em local úmido por longos períodos. Um local ventilado costuma ser uma escolha mais prática.\n\n### Como guardar maiô com bojo?\nSiga a orientação do fabricante e evite dobrar ou pressionar o bojo de modo que altere sua forma.\n\n### Devo pendurar ou dobrar o biquíni?\nDepende da peça e do espaço. Escolha uma forma que não estique alças nem deforme detalhes; a etiqueta pode trazer instruções específicas.\n\n### Posso guardar roupas de banho juntas?\nSim, desde que estejam secas e que fechos ou enfeites não prendam ou danifiquem outras peças.\n\n### Como guardar peças no fim do verão?\nLave, enxágue e seque completamente. Depois, guarde em local limpo e seco, verificando a ventilação e a ausência de umidade.\n\nO armazenamento correto começa antes da gaveta: lave conforme a etiqueta, seque por inteiro e organize sem apertar. Assim, as peças ficam prontas para o próximo uso e mais fáceis de encontrar.",
  "tempoLeitura": "5 min de leitura",
  "status": "publicado",
  "dataCriacao": "2026-10-25"
}
