{
  "id": "art_seo_topfitness",
  "slug": "como-escolher-top-fitness",
  "titulo": "Como escolher um top fitness para sua rotina de treinos",
  "categoria": "treino-performance",
  "resumo": "Compare ajuste, conforto, alças e tipo de atividade para escolher um top fitness que combine com sua rotina.",
  "capa": {
    "arquivo": "pecas-movimento.webp",
    "alt": "Referência de roupa fitness para escolher um top de treino"
  },
  "corpo": "Para escolher um top fitness, comece pela atividade que você pratica, pelo ajuste que considera confortável e pelas informações disponíveis na ficha do produto. Um top para uma rotina de alongamento pode ter necessidades diferentes de uma peça usada em atividades com muitos saltos ou movimentos repetitivos. Não presuma que todos os modelos oferecem o mesmo nível de sustentação.\n\nA escolha também depende de preferências pessoais: largura das alças, cobertura, formato das costas e sensação do tecido. Compare esses detalhes antes de decidir pela cor ou pela tendência.\n\n## Considere o tipo de treino\n\nPense nos movimentos que você faz com mais frequência. Caminhada, yoga, musculação, corrida e aulas com saltos podem exigir sensações diferentes de ajuste. Confira se a descrição do produto informa o uso pretendido ou características específicas para a atividade.\n\nNão conclua que um top é adequado para alto impacto apenas porque parece firme na fotografia. Quando o fabricante não informa o nível de sustentação, pergunte à loja em vez de assumir um benefício técnico.\n\n## Observe o ajuste\n\nO top deve ficar estável sem causar dor ou restringir a respiração. Veja se as alças permanecem no lugar, se a faixa inferior não sobe continuamente e se o tecido não repuxa de maneira desconfortável. Faça movimentos leves ao experimentar, como levantar os braços e girar o tronco.\n\nSe a peça escorrega, aperta ou precisa ser reposicionada repetidamente, pode valer a pena testar outro tamanho ou modelagem. O tamanho que você usa em outras marcas serve apenas como referência; consulte a tabela de medidas quando estiver disponível.\n\n## Compare alças e costas\n\nAlças finas, largas, cruzadas ou em formato nadador criam sensações e visuais diferentes. Alças ajustáveis podem ajudar a personalizar o caimento, enquanto um modelo fechado nas costas pode ter uma distribuição de tecido diferente de um top com recortes.\n\nNão existe um formato melhor para todo mundo. Avalie se a construção combina com seu movimento e se você gosta da sensação ao vestir. Observe também como a peça é colocada e retirada, especialmente se tiver uma faixa firme.\n\n## Leia a descrição do tecido\n\nConfira a composição quando publicada e siga as instruções de lavagem. Não presuma que todo top fitness tenha a mesma compressão, opacidade, secagem ou composição. Se uma característica for importante para sua compra, procure essa informação na ficha ou pergunte ao atendimento.\n\nA cor e a estampa podem ser parte da escolha, mas não substituem a avaliação de tamanho, acabamento e uso pretendido.\n\n## Monte uma rotina de cuidados\n\nLave a peça conforme a etiqueta, evite produtos que o fabricante não recomende e não use calor excessivo sem autorização. Deixe secar completamente antes de guardar. Roupas usadas durante o exercício podem precisar ser lavadas logo após o treino, especialmente se ficaram úmidas por muito tempo.\n\nEsses hábitos ajudam a reduzir desgaste evitável, mas não garantem uma duração específica: o resultado depende da construção, da frequência de uso e das condições de conservação.\n\n## Perguntas frequentes\n\n### Qual top fitness é melhor para academia?\nEscolha de acordo com a atividade, o ajuste e o nível de sustentação informado pelo fabricante. Não existe um único modelo ideal para todas as rotinas.\n\n### Como saber se o top está apertado?\nObserve se causa dor, limita a respiração ou deixa marcas desconfortáveis. A peça deve ficar estável sem incomodar.\n\n### Posso usar top de biquíni para treinar?\nNão presuma que um top de biquíni foi projetado para exercício. Compare a finalidade e as informações do produto antes de escolher.\n\n### Como escolher o tamanho online?\nConsulte a tabela de medidas quando disponível e confira as características específicas do modelo.\n\n### Como lavar um top fitness?\nSiga a etiqueta. Evite torção forte, produtos agressivos e calor não recomendado.\n\nA escolha começa pelo uso real que você fará da peça. Compare ajuste, construção e informações confirmadas, e priorize o conforto em vez de confiar apenas na aparência.",
  "tempoLeitura": "5 min de leitura",
  "status": "publicado",
  "dataCriacao": "2026-10-25"
}
