{
  "id": "art_cuidadosbiquini",
  "slug": "cuidados-biquini",
  "titulo": "Como cuidar do seu biquíni e fazer durar muito mais",
  "categoria": "guia-de-cuidados",
  "resumo": "Dicas práticas para conservar a cor, a elasticidade e o caimento das peças.",
  "corpo": "Um biquíni Turkista é feito para acompanhar praia, sol e água salgada — mas a lycra de alto padrão que usamos só entrega essa durabilidade toda se o cuidado no dia a dia for simples e consistente. Não é sobre produtos caros ou rotina complicada: é sobre alguns hábitos que fazem toda a diferença ao longo de meses de uso.\n\nA regra de ouro é lavar sempre à mão, em água fria, com sabão neutro — nunca na máquina, e nunca com alvejante ou amaciante. Esses produtos atacam o elastano presente na lycra e são a principal causa de peças que perdem sustentação antes da hora. Depois de lavar, aperte suavemente para tirar o excesso de água, sem torcer, e deixe secar à sombra, estendida ou sobre uma toalha.\n\nOutro ponto que faz muita diferença: enxaguar a peça em água doce assim que possível depois de um mergulho no mar ou na piscina. O cloro e o sal, se ficam muito tempo em contato com o tecido, aceleram o desgaste — e esse é um cuidado que leva menos de um minuto.\n\n> Lycra boa dura anos quando recebe cuidado simples — e isso começa em como você lava e onde você guarda a peça.\n\nVale também prestar atenção ao contato com protetor solar e óleos corporais antes de vestir a peça: esses produtos, quando ainda não absorvidos pela pele, aceleram o desgaste do tecido. O ideal é esperar alguns minutos após passar protetor antes de colocar o biquíni.\n\nE se, mesmo com todo cuidado, um ponto soltar com o uso normal? Aqui na Turkista a gente acredita em conserto, não em descarte.",
  "capa": {
    "arquivo": "cuidados-biquini.webp",
    "alt": "Como cuidar do seu biquíni e fazer durar muito mais"
  },
  "tempoLeitura": "4 min de leitura",
  "status": "publicado",
  "dataCriacao": "2026-08-18"
}
