{
  "id": "art_roupafit",
  "slug": "roupa-fitness-conforto-ou-estilo-voce-nao-precisa-escolher",
  "titulo": "Roupa fitness: conforto ou estilo? Você não precisa escolher",
  "categoria": "estilo",
  "resumo": "Por muito tempo, escolher uma roupa para treinar parecia significar optar entre duas coisas: conforto ou estilo.",
  "corpo": "Por muito tempo, escolher uma roupa para treinar parecia significar optar entre duas coisas: **conforto ou estilo**. Ou a peça era confortável, mas sem graça, ou era bonita, mas não acompanhava os movimentos do corpo.\r\n\r\nHoje, essa escolha ficou para trás.\r\n\r\nA moda fitness evoluiu e trouxe peças que unem **tecnologia, conforto, funcionalidade e personalidade**. Afinal, se você vai passar horas usando uma roupa, por que não escolher uma que faça você se sentir bem e ainda valorize o seu estilo?\r\n\r\n## Conforto é essencial\r\n\r\nDurante o treino, a roupa precisa acompanhar o corpo — e não atrapalhar seus movimentos.\r\n\r\nUma boa peça fitness deve oferecer elasticidade, liberdade de movimento e uma modelagem que se adapte ao corpo. Tecidos com boa respirabilidade também ajudam a manter a pele mais confortável durante atividades de maior intensidade.\r\n\r\nA escolha da peça certa faz diferença principalmente em exercícios que exigem muitos movimentos, como musculação, corrida, funcional, dança, yoga e pilates.\r\n\r\n**Quando a roupa acompanha você, o treino fica muito mais confortável.**\r\n\r\n## Mas e o estilo?\r\n\r\nQuem disse que roupa de academia precisa ser básica?\r\n\r\nA moda fitness ganhou espaço justamente porque passou a valorizar também a expressão individual. Cores marcantes, recortes, texturas, diferentes modelagens e combinações permitem criar looks que têm tudo a ver com a personalidade de quem usa.\r\n\r\nUma legging pode ser muito mais do que uma peça para treinar. Um top pode ganhar destaque no look. Um conjunto pode transmitir uma estética mais sofisticada, vibrante, minimalista ou ousada.\r\n\r\nO importante é encontrar peças que façam sentido para **você**.\r\n\r\n## A peça perfeita é aquela que une os dois\r\n\r\nConforto e estilo não são opostos.\r\n\r\nUma roupa fitness pode ter um design bonito e, ao mesmo tempo, oferecer sustentação, flexibilidade e segurança para os movimentos.\r\n\r\nNa hora de escolher, vale observar alguns detalhes:\r\n\r\n**✔ Modelagem:** a peça precisa vestir bem sem limitar os movimentos.\r\n\r\n**✔ Tecido:** procure materiais que ofereçam elasticidade e conforto para a atividade que você pratica.\r\n\r\n**✔ Sustentação:** tops e peças de maior suporte devem ser escolhidos de acordo com a intensidade do exercício.\r\n\r\n**✔ Transparência:** principalmente em leggings e shorts, é importante verificar como o tecido se comporta durante os movimentos.\r\n\r\n**✔ Seu estilo:** escolha cores, cortes e combinações que façam você se sentir confiante.\r\n\r\n## Seu look também faz parte da experiência\r\n\r\nExiste algo especial em vestir uma roupa que faz você se sentir bem antes mesmo de começar o treino.\r\n\r\nNão significa que uma roupa bonita vai transformar seu desempenho. Mas sentir-se confortável e confiante pode tornar o momento do exercício mais agradável e fazer com que você aproveite melhor a experiência.\r\n\r\nA roupa deixa de ser apenas uma necessidade e passa a fazer parte do seu estilo de vida.\r\n\r\n### Afinal, por que escolher?\r\n\r\nVocê não precisa escolher entre **conforto e estilo**.\r\n\r\nA moda fitness atual permite que você tenha liberdade para se movimentar, conforto para treinar e um visual que combine com a sua personalidade.\r\n\r\nPorque cuidar do corpo também pode ser uma experiência de estilo.\r\n\r\n**Vista o que faz você se sentir bem. Treine do seu jeito. E não abra mão de nenhum dos dois.**",
  "capa": {
    "arquivo": "roupa-fitness-conforto-ou-estilo-voce-nao-precisa-escolher.webp",
    "alt": "Roupa fitness: conforto ou estilo? Você não precisa escolher"
  },
  "tempoLeitura": "3 min de leitura",
  "status": "publicado",
  "dataCriacao": "2026-09-26"
}