{
  "id": "art_seo_guarda",
  "slug": "como-montar-guarda-roupa-moda-praia",
  "titulo": "Guarda-roupa de moda praia: como escolher peças versáteis",
  "categoria": "estilo",
  "resumo": "Planeje um guarda-roupa de praia com peças que combinem entre si, considerando preferências, ocasiões e cuidados.",
  "capa": {
    "arquivo": "cuidados-biquini.webp",
    "alt": "Referência de peças de moda praia para planejar um guarda-roupa versátil"
  },
  "corpo": "Montar um guarda-roupa de moda praia versátil começa por entender como você usa as peças. Considere quantas vezes vai à praia ou à piscina, quais modelos prefere e o que já tem. Depois, escolha itens que combinem entre si, em vez de comprar peças isoladas que só funcionem em uma composição.\n\nA quantidade ideal depende da sua rotina, da duração das viagens e das preferências pessoais. Não é necessário seguir uma lista fixa para todas as pessoas.\n\n## Comece pelo que você já possui\n\nSepare biquínis, maiôs, saídas de praia e acessórios. Observe quais peças estão em boas condições, quais cores se repetem e quais itens você realmente usa. Essa revisão ajuda a perceber se falta uma parte inferior para combinar com tops avulsos ou uma peça neutra para equilibrar estampas.\n\nAntes de comprar, faça uma lista curta do que faria diferença no seu dia a dia.\n\n## Escolha uma paleta de cores\n\nUma paleta pequena facilita combinações. Você pode escolher dois tons neutros e acrescentar uma ou duas cores vibrantes, ou montar uma paleta de cores que goste de usar. O importante é que as peças conversem entre si sem limitar seu estilo.\n\nSe prefere estampas, escolha desenhos que compartilhem algumas cores ou combine-os com peças lisas. Não existe uma regra obrigatória de cores para cada pessoa.\n\n## Varie modelos conforme o uso\n\nConsidere ter opções que atendam às suas preferências: tops com diferentes alças, partes de baixo com coberturas variadas ou um maiô para determinadas ocasiões. A seleção depende do que você realmente usa e do conforto que procura.\n\nNão presuma que todos os modelos sejam adequados para qualquer atividade. Se pretende nadar ou praticar esportes, confira a construção e as informações do fabricante para escolher uma peça compatível com o uso planejado.\n\n## Aproveite peças avulsas e dupla face\n\nPartes vendidas separadamente podem ampliar as combinações. Um top avulso pode ser usado com mais de uma calcinha, e um modelo dupla face pode oferecer alternativas de visual quando essa característica está indicada pelo fabricante.\n\nAntes de comprar, confirme o que está incluído na venda e veja se as peças combinam com itens que você já possui. Isso ajuda a planejar compras mais úteis.\n\n## Considere saídas e acessórios\n\nUma saída de praia, camisa leve ou acessório pode mudar a composição sem exigir outro biquíni. Escolha itens que sejam confortáveis e adequados à ocasião. Um acessório neutro pode acompanhar diferentes cores; uma peça estampada pode se tornar o destaque do look.\n\n## Cuide das peças para aproveitar melhor\n\nLave conforme a etiqueta, enxágue após o uso no mar ou na piscina e deixe secar completamente antes de guardar. Evite torcer com força e comprimir detalhes delicados. A conservação adequada ajuda a reduzir desgaste evitável, embora a durabilidade dependa de vários fatores.\n\n## Perguntas frequentes\n\n### Quantos biquínis preciso ter?\nDepende da frequência de uso, da rotina e das suas preferências. Planeje de acordo com as ocasiões reais, não com um número fixo.\n\n### Como montar um guarda-roupa versátil?\nEscolha uma paleta de cores e priorize peças que combinem com mais de um item existente.\n\n### Vale a pena comprar partes avulsas?\nPode valer se as peças combinarem com o que você já tem. Confirme se cada anúncio inclui apenas uma parte ou um conjunto.\n\n### Um maiô pode ampliar as combinações?\nAlguns modelos podem ser usados com outras roupas, dependendo do corte e do tecido. Avalie cada peça individualmente.\n\n### Como evitar compras repetidas?\nRevise o guarda-roupa antes de comprar e anote quais combinações ou modelos realmente estão faltando.\n\nUm guarda-roupa de praia útil não precisa ser grande. Escolha peças que combinem com seu estilo, planeje as compras e cuide dos itens para aproveitá-los melhor.",
  "tempoLeitura": "5 min de leitura",
  "status": "publicado",
  "dataCriacao": "2026-10-25"
}
