{
  "id": "art_seo_acabamento",
  "slug": "acabamento-roupa-moda-praia",
  "titulo": "O que observar no acabamento de um biquíni ou maiô",
  "categoria": "tecido-tecnologia",
  "resumo": "Aprenda a observar costuras, forro, elásticos e fechos ao avaliar o acabamento de uma peça de moda praia.",
  "capa": {
    "arquivo": "atelie-peca-pronta.webp",
    "alt": "Referência de confecção para observar detalhes de acabamento em moda praia"
  },
  "corpo": "Ao avaliar o acabamento de um biquíni ou maiô, observe as costuras, as bordas, o forro quando houver, as alças e os fechos. Esses detalhes ajudam a entender a construção visível da peça, embora uma avaliação visual não permita garantir a durabilidade nem substituir as informações do fabricante.\n\nAntes de comprar, examine as fotos disponíveis e leia a descrição. Não presuma que todos os modelos tenham o mesmo tipo de forro, elástico ou acabamento.\n\n## Observe as costuras\n\nConfira se as costuras parecem uniformes e se há fios soltos, pontos abertos ou áreas repuxadas. Olhe com atenção as regiões de maior tensão, como a ligação entre alças e corpo da peça e as bordas de tops e calcinhas.\n\nUm fio solto isolado não explica por si só como a peça foi confeccionada, mas é um sinal visível que merece atenção. Evite puxar fios para testar a resistência, pois isso pode causar dano.\n\n## Confira as bordas e o elástico\n\nAs bordas devem parecer bem finalizadas e acompanhar o contorno da peça sem ondulações incomuns. Quando houver elástico aparente ou embutido, observe como ele está integrado ao tecido. Não tente esticar excessivamente a peça para avaliar a construção.\n\nO ajuste também influencia a aparência: um modelo pode ter franzidos ou recortes intencionais. Compare com as fotos e a descrição antes de concluir que uma característica é um defeito.\n\n## Verifique o forro quando houver\n\nAlguns modelos têm forro, enquanto outros podem ter construção diferente. Se a presença de forro for importante para você, procure essa informação na ficha e observe as fotos de detalhes. Não presuma que todo biquíni ou maiô tenha a mesma estrutura interna.\n\nConfira se as bordas do forro ficam bem posicionadas e se não há partes que repuxam visivelmente. A imagem pode não mostrar todos os detalhes, então pergunte à loja quando faltar informação.\n\n## Avalie alças, amarrações e fechos\n\nAlças ajustáveis, nós, argolas e fechos podem mudar o modo como a peça veste e como deve ser manuseada. Observe se os componentes estão descritos e se o mecanismo de ajuste é compatível com sua preferência. Não puxe as alças com força nem teste fechos de forma agressiva.\n\nSe o produto tiver detalhes metálicos ou decorativos, confira as instruções de cuidado para saber como conservá-los.\n\n## Leia a ficha do produto\n\nA descrição pode esclarecer composição, modelagem, presença de bojo, forro e cuidados, quando esses dados tiverem sido informados. Use essas informações para complementar o que aparece nas fotos. Não atribua à marca um padrão específico de construção sem evidência publicada.\n\nNa compra online, se você precisa confirmar uma característica que não está descrita, entre em contato com a loja antes de concluir o pedido.\n\n## Cuide do acabamento após a compra\n\nSiga a etiqueta de lavagem, evite torcer com força e não esfregue áreas delicadas com escovas. Enxágue a peça após o uso no mar ou na piscina e guarde somente quando estiver completamente seca. Esses hábitos ajudam a evitar desgastes desnecessários, mas não garantem um prazo de durabilidade.\n\n## Perguntas frequentes\n\n### Como saber se uma costura está bem feita?\nObserve se os pontos parecem uniformes e se não há fios soltos ou aberturas visíveis. A inspeção visual não garante a resistência em uso.\n\n### Todo maiô precisa ter forro?\nNão necessariamente. A construção varia por modelo. Confira a descrição do produto.\n\n### O que observar nas alças?\nVeja como estão unidas à peça, se há regulagem e se o acabamento parece uniforme. Evite puxar com força.\n\n### Posso avaliar o acabamento apenas pelas fotos?\nAs fotos ajudam, mas não mostram todos os detalhes. Pergunte à loja se faltar informação importante.\n\n### Como preservar costuras e elásticos?\nSiga a etiqueta, reduza o atrito e evite torcer ou puxar a peça com força.\n\nObservar o acabamento ajuda a fazer perguntas mais específicas e a comparar produtos com atenção. Combine a inspeção visual com a ficha do produto e não presuma características que não foram informadas.",
  "tempoLeitura": "5 min de leitura",
  "status": "publicado",
  "dataCriacao": "2026-10-25"
}
