{
  "id": "art_corestomdepele",
  "slug": "cores-tom-de-pele",
  "titulo": "Cores que valorizam seu tom de pele",
  "categoria": "estilo",
  "resumo": "Veja como escolher cores de biquíni e moda praia que criam contraste com tons de pele quentes ou frios, sem seguir regras rígidas de estilo.",
  "corpo": "Escolher a cor de uma peça de praia costuma gerar mais dúvida do que escolher o modelo em si — e a boa notícia é que não existe regra rígida, só algumas direções que costumam funcionar bem e ajudam a decidir com mais confiança.\n\nTons de pele mais quentes tendem a ganhar bastante contraste com cores vibrantes e profundas, como o rosa Turkista — elas conversam bem com dourado e bronzeado da pele. Tons de pele mais frios costumam se destacar em cores com um leve subtom azulado ou em contrastes de preto grafite, que criam uma linha limpa e sofisticada.\n\nFora essa lógica de contraste, vale lembrar que a cor que te deixa mais confiante para curtir o dia é sempre a escolha certa — nenhuma regra de estilo compensa uma peça em que você não se sente à vontade.\n\n> Regra de cor é ponto de partida, não decisão final. A peça certa é a que te faz esquecer que está usando roupa.\n\nNa dúvida entre duas cores, manda uma mensagem no WhatsApp — a gente ajuda a pensar na combinação considerando seu tom de pele e a linha que você está buscando.",
  "capa": {
    "arquivo": "cores-tom-de-pele.webp",
    "alt": "Cores que valorizam seu tom de pele"
  },
  "tempoLeitura": "3 min de leitura",
  "status": "publicado",
  "dataCriacao": "2026-08-18"
}
